{"apiVersion":"purview-remote-state/v1","dataSources":[{"creationType":"Manual","kind":"AzureStorage","name":"example-source","observedProperties":{},"properties":{"collection":{"referenceName":"root"},"dataSourceCollectionMovingState":"Active","endpoint":"https://example.blob.core.windows.net/"},"type":"dataSource"}],"materialStateIdentity":"sha256:af6bfd718b0bdd54de8ba28e20e1bf5fac8e49c96a90d9e60ee4929edbd8f03e","uninterpretedDataSources":[]}